{"$schema":"https://json-schema.org/draft/2020-12/schema","type":"object","required":["schemaVersion","versionId","frameworkId","sourceCommit","catalogSnapshotId","catalogRootHash","symbolSnapshotId","symbolRootHash","createdAt","sourceClean","warnings"],"properties":{"schemaVersion":{"type":"string"},"versionId":{"type":"string","pattern":"^[A-Za-z0-9._-]+$"},"frameworkId":{"type":"string"},"repositoryUrl":{"type":["string","null"]},"sourceCommit":{"type":"string","pattern":"^[a-f0-9]{40}$"},"sourceTag":{"type":["string","null"]},"branch":{"type":["string","null"]},"catalogSnapshotId":{"type":"string"},"catalogRootHash":{"type":"string","pattern":"^sha256:"},"symbolSnapshotId":{"type":"string"},"symbolRootHash":{"type":"string","pattern":"^sha256:"},"knowledgeIndexSha256":{"type":["string","null"]},"createdAt":{"type":"string"},"sourceClean":{"type":"boolean"},"previousVersionId":{"type":["string","null"]},"scannerVersions":{"type":"object"},"warnings":{"type":"array","items":{"type":"string"}}}}
